{
  "schema_version": "1.0",
  "channel": "preview",
  "release_tag": null,
  "app_version": "1.0.5",
  "app_build_code": 101,
  "commit": null,
  "built_at": null,
  "overall_status": "PREVIEW",
  "artifacts": [],
  "public_surfaces": {
    "android": {
      "name": "UniApp Android",
      "role": "mainline",
      "capability_status": "PREVIEW",
      "release_status": "NOT_RELEASED",
      "artifact": null
    },
    "h5": {
      "name": "H5",
      "role": "degradation",
      "capability_status": "UNSUPPORTED",
      "release_status": "NOT_RELEASED"
    },
    "ios": {
      "name": "iOS",
      "role": "mainline",
      "capability_status": "PREVIEW",
      "release_status": "NOT_RELEASED",
      "reason": "原生 SwiftUI 已有正式签名历史包；本轮 OTA 修复后须重新归档签名，并完成真实 BLE 与商店服务端验证。"
    },
    "flutter_tauri_native": {
      "name": "Flutter / Tauri / 原生端",
      "role": "mainline",
      "capability_status": "PREVIEW",
      "release_status": "NOT_RELEASED",
      "reason": "2026-10-10 用户将所有技术实现纳入完整验收与发布范围；各平台当前证据见 release/platform-matrix.json。"
    },
    "peripheral": {
      "name": "LightBLE ESP32 Peripheral",
      "role": "fixture",
      "capability_status": "PREVIEW",
      "release_status": "NOT_RELEASED",
      "artifact": null
    },
    "observer": {
      "name": "ESP32 Observer",
      "role": "fixture",
      "capability_status": "NOT_RELEASED",
      "release_status": "NOT_RELEASED",
      "artifact": null
    },
    "ota": {
      "name": "OTA",
      "role": "capability",
      "capability_status": "BLOCKED",
      "release_status": "NOT_RELEASED",
      "reason": "本地包协议、客户端及固件事务已补齐；真实 BLE/Flash/重启版本验证 E5 尚未完成，详见 release/ota-verification-2026-10-20.json"
    },
    "smart_hid": {
      "name": "Smart HID",
      "role": "capability",
      "capability_status": "PREVIEW",
      "release_status": "NOT_RELEASED",
      "reason": "第一方 Profile 已有实现路径，端到端 E5 未完成"
    }
  },
  "verified_capabilities": [],
  "known_limitations": [
    "Android 正式 APK 尚未发布",
    "Playwright / Page Driver E4 页面驱动层为 Fake Runtime 模式（真机/真实 H5 驱动未接入）",
    "Android、ESP32 E5 真机验证尚未执行（iOS 已有真机安装+启动证据，完整 BLE E5 链未复验）",
    "OTA 当前 BLOCKED（协议与固件修复后仍需真实设备 E5；设备提交回执不代替重启版本回读）",
    "ESP32 Observer 已有构建；真实接收仍待验证，当前不提供 OTA 服务",
    "Smart HID 尚未完成端到端 E5",
    "Release Pipeline 已切换为 CI 候选产物模式（preview 渠道，artifacts 空，不自动发布）；UniApp Android 正式 APK 仍由 HBuilderX 打包，尚未管线化",
    "微信小程序运行目标已于 2026-09-11 退役（历史文档与冻结原型保留）",
    "2026-10-19 的 1.0.5/101 安装包不包含本轮 OTA 修复，不能作为修复后的上架包；需在真实设备验证后重新构建签名"
  ],
  "tested_devices": [],
  "evidence_ids": []
}
