{
  "schema_version": "1.0",
  "channel": "preview",
  "release_tag": null,
  "app_version": "1.0.5",
  "app_build_code": 101,
  "commit": null,
  "built_at": null,
  "overall_status": "PREVIEW",
  "artifacts": [],
  "public_surfaces": {
    "android": {
      "name": "UniApp Android",
      "role": "mainline",
      "capability_status": "PREVIEW",
      "release_status": "NOT_RELEASED",
      "artifact": null
    },
    "h5": {
      "name": "H5",
      "role": "degradation",
      "capability_status": "UNSUPPORTED",
      "release_status": "NOT_RELEASED"
    },
    "ios": {
      "name": "iOS",
      "role": "mainline",
      "capability_status": "PREVIEW",
      "release_status": "NOT_RELEASED",
      "reason": "纯原生 SwiftUI 功能与默认/关键交互态已实现；真机签名 E5 尚未完成"
    },
    "flutter_tauri_native": {
      "name": "Flutter / Tauri / 原生端",
      "role": "REFERENCE",
      "capability_status": null,
      "release_status": "NOT_RELEASED"
    },
    "peripheral": {
      "name": "LightBLE ESP32 Peripheral",
      "role": "fixture",
      "capability_status": "PREVIEW",
      "release_status": "NOT_RELEASED",
      "artifact": null
    },
    "observer": {
      "name": "ESP32 Observer",
      "role": "fixture",
      "capability_status": "NOT_RELEASED",
      "release_status": "NOT_RELEASED",
      "artifact": null
    },
    "ota": {
      "name": "OTA",
      "role": "capability",
      "capability_status": "BLOCKED",
      "release_status": "NOT_RELEASED",
      "reason": "客户端与固件完整事务尚未对齐并完成 E5"
    },
    "smart_hid": {
      "name": "Smart HID",
      "role": "capability",
      "capability_status": "PREVIEW",
      "release_status": "NOT_RELEASED",
      "reason": "第一方 Profile 已有实现路径，端到端 E5 未完成"
    }
  },
  "verified_capabilities": [],
  "known_limitations": [
    "Android 正式 APK 尚未发布",
    "Playwright / Page Driver E4 尚未完成",
    "Android、ESP32 E5 尚未执行",
    "iOS 真机签名与 E5 验证尚未完成",
    "OTA 当前 BLOCKED",
    "ESP32 Observer 尚未完成",
    "Smart HID 尚未完成端到端 E5",
    "Release Pipeline 仍为历史 Flutter/Tauri 路线"
  ],
  "tested_devices": [],
  "evidence_ids": []
}
