{
  "schema_version": "1.0",
  "channel": "preview",
  "release_tag": null,
  "app_version": "1.0.5",
  "app_build_code": 101,
  "commit": null,
  "built_at": null,
  "overall_status": "PREVIEW",
  "artifacts": [],
  "public_surfaces": {
    "android": {
      "name": "UniApp Android",
      "role": "mainline",
      "capability_status": "PREVIEW",
      "release_status": "NOT_RELEASED",
      "artifact": null
    },
    "h5": {
      "name": "H5",
      "role": "degradation",
      "capability_status": "UNSUPPORTED",
      "release_status": "NOT_RELEASED"
    },
    "ios": {
      "name": "iOS",
      "role": "mainline",
      "capability_status": "PREVIEW",
      "release_status": "NOT_RELEASED",
      "reason": "原生 SwiftUI 模拟器单测/UI 测试与 unsigned Archive 已通过；真实设备 BLE、分发签名和商店提交分别待验。"
    },
    "flutter_tauri_native": {
      "name": "Flutter / Tauri / 原生端",
      "role": "mainline",
      "capability_status": "PREVIEW",
      "release_status": "NOT_RELEASED",
      "reason": "2026-10-10 用户将所有技术实现纳入完整验收与发布范围；各平台当前证据见 release/platform-matrix.json。"
    },
    "peripheral": {
      "name": "LightBLE ESP32 Peripheral",
      "role": "fixture",
      "capability_status": "PREVIEW",
      "release_status": "NOT_RELEASED",
      "artifact": null
    },
    "observer": {
      "name": "ESP32 Observer",
      "role": "fixture",
      "capability_status": "NOT_RELEASED",
      "release_status": "NOT_RELEASED",
      "artifact": null
    },
    "ota": {
      "name": "OTA",
      "role": "capability",
      "capability_status": "BLOCKED",
      "release_status": "NOT_RELEASED",
      "reason": "客户端与固件完整事务尚未对齐并完成 E5"
    },
    "smart_hid": {
      "name": "Smart HID",
      "role": "capability",
      "capability_status": "PREVIEW",
      "release_status": "NOT_RELEASED",
      "reason": "第一方 Profile 已有实现路径，端到端 E5 未完成"
    }
  },
  "verified_capabilities": [],
  "known_limitations": [
    "Android 正式 APK 尚未发布",
    "Playwright / Page Driver E4 页面驱动层为 Fake Runtime 模式（真机/真实 H5 驱动未接入）",
    "Android、ESP32 E5 真机验证尚未执行（iOS 已有真机安装+启动证据，完整 BLE E5 链未复验）",
    "OTA 当前 BLOCKED（客户端 CTRL 事务与固件契约分歧待裁决）",
    "ESP32 Observer 固件尚未完成",
    "Smart HID 尚未完成端到端 E5",
    "Release Pipeline 已切换为 CI 候选产物模式（preview 渠道，artifacts 空，不自动发布）；UniApp Android 正式 APK 仍由 HBuilderX 打包，尚未管线化",
    "微信小程序运行目标已于 2026-09-11 退役（历史文档与冻结原型保留）"
  ],
  "tested_devices": [],
  "evidence_ids": []
}
